{
  "meta": {
    "edition": 7,
    "week": "31 ago-6 sep 2026",
    "dates": "31 ago-6 sep 2026",
    "timestamp": "2026-08-31"
  },
  "hero": {
    "eyebrow": "Informe de inteligencia - No es noticias, es interpretacion",
    "title": "Doble apreton al costo puesto -crudo Y flete suben a la vez- justo cuando se abre la mayor ventana de exportacion a EE.UU. en anos para Domicem.",
    "lede": "Semana atipica: los dos vectores de costo empujan al alza al mismo tiempo. El Brent salto a ~US$90.8 (+8,4% en el mes, +33% en el ano) por la tension en el Estrecho de Ormuz, y el flete a granel, lejos de enfriarse, se afirmo -el Baltic rebota a ~3.186 y el Panamax (la clase que mueve clinker) sube a ~US$20.600/dia, con el Capesize disparado a ~US$46.600-. El clinker CIF Caribe recibe presion por ambos lados a la vez: raro y adverso. Pero el titular estrategico esta en el norte: Washington golpeo al cemento canadiense con un arancel de 50% (vigente desde ~19-20 ago) mientras Republica Dominicana entra a EE.UU. cerca del ~6-10% y sin orden antidumping vigente -con Florida/Golfo en escasez estructural. Abajo: los 10 eventos que importan, que significan para Argos PR y Domicem, y las 3 preguntas del proximo consejo.",
    "stamp": "Datos al 27-31 ago 2026 (macro y crudo al 31 ago; fletes al 27-28 ago; indices mensuales/trimestrales de jul-ago 2026). Las cifras marcadas EST son estimaciones trianguladas, no precios cotizados. Metodologia y fuentes al pie."
  },
  "executiveSummary": [
    {
      "title": "Doble apreton: crudo Y flete suben a la vez sobre el costo puesto",
      "category": "cost",
      "categoryLabel": "Costo",
      "description": "Semana inusual: el clinker CIF Caribe recibe presion al alza por los dos lados. El Brent trepo a ~US$90.8 (+8,4% mensual) por Ormuz, encareciendo petcoke, diesel y bunker; y el flete a granel se afirmo en vez de ceder (BDI ~3.186, Panamax ~US$20.600/dia). Cuando ambos vectores empujan juntos, el margen del importador se comprime sin que la fabrica cambie nada."
    },
    {
      "title": "Arancel de 50% de EE.UU. a Canada: se abre la mayor ventana de exportacion para RD",
      "category": "opportunity",
      "categoryLabel": "Oportunidad",
      "description": "Washington aplico ~50% al cemento canadiense (vigente ~19-20 ago), sacando de precio a uno de sus cuatro mayores proveedores en el Noreste/Grandes Lagos. RD entra a EE.UU. cerca del ~6-10% efectivo y sin orden AD/CVD vigente. Con Florida/Golfo en escasez (terminales cubren ~12% de la demanda regional), es la ventana exportadora mas clara en anos para Domicem."
    },
    {
      "title": "El crudo vuelve a mandar: Brent ~US$90.8 por la tension en Ormuz",
      "category": "cost",
      "categoryLabel": "Costo",
      "description": "Ataques y ruido en el Estrecho de Ormuz empujaron al Brent +3,1% en el dia a US$90.84 y al WTI a ~US$84.8. Es prima de riesgo geopolitico, no escasez fisica -Persian Gulf exporta ~15-16 mb/d-, pero se traduce directo en costo de energia del horno y en el bunker del flete. El comodin que puede recalentar todo el tablero."
    },
    {
      "title": "El flete no se enfria: BDI rebota a ~3.186 con el Capesize disparado",
      "category": "cost",
      "categoryLabel": "Costo",
      "description": "Contra el patron de las semanas previas, el flete a granel se afirmo: el Baltic subio a ~3.186 (desde ~2.863) empujado por el Capesize (~US$46.600/dia) con mineral de hierro. El Panamax -clase clinkera- sube a ~US$20.600/dia. El componente flete del clinker CIF Caribe deja de aliviar y vuelve a sumar costo."
    },
    {
      "title": "La ventana de importacion en Jamaica empieza a cerrarse: Carib Cement reexporta en septiembre",
      "category": "competition",
      "categoryLabel": "Competencia",
      "description": "Caribbean Cement (Cemex) pasa de importar a REEXPORTAR desde septiembre, apuntando a Cayman y Bahamas, tras un 1S26 record (TCL triplico utilidad, Jamaica ~98% del resultado operativo). El incumbente se normaliza y se vuelve rival en mercados vecinos: la ventana de ~cupos jamaicanos para importadores se estrecha -hay que colocar tonelada ya."
    },
    {
      "title": "RD confirmada como #1 exportador regional: 25,4% de US$581,3M",
      "category": "competition",
      "categoryLabel": "Competencia",
      "description": "ADOCEM confirma a Republica Dominicana como el mayor exportador de cemento/cal/yeso de America Latina y el Caribe (25,4% del total regional en 2025, por delante de Mexico y Guatemala). El excedente exportable de RD -Cemex/Progreso, Domicem, Cibao, Panam- es real y busca destino: EE.UU. y las plazas caribenas quedan a tiro."
    },
    {
      "title": "Cemex sostiene guia 2026 al alza tras trimestre record",
      "category": "competition",
      "categoryLabel": "Competencia",
      "description": "El Q2 de Cemex trajo flujo de caja record y EBITDA +24%, con guia elevada. Es el mismo grupo dueno de Caribbean Cement y Cemex Bahamas -nodos de suministro regional-. Fortaleza corporativa y capital que fluye a bolt-ons en EE.UU. (Omega, Tampa), no a nueva capacidad caribena: el Caribe queda como plaza de suministro, no de inversion."
    },
    {
      "title": "Barbados deja de fabricar: Arawak (TCL) cesa produccion",
      "category": "competition",
      "categoryLabel": "Competencia",
      "description": "TCL confirmo que Arawak Cement (St. Lucy) dejo de manufacturar: Barbados ya no aporta a la produccion y queda estructuralmente dependiente de importacion. Una plaza mas del Caribe que se abre a origenes externos -incluida RD, aunque el CET del CARICOM pesa sobre el cemento dominicano alli."
    },
    {
      "title": "Divisas del Caribe: TRY en minimos historicos, COP se fortalece, DOP ~58,7",
      "category": "demand",
      "categoryLabel": "Demanda",
      "description": "La lira en minimos (USD/TRY ~48,3) abarata el clinker turco en USD; el peso colombiano mas fuerte (USD/COP ~3.194) encarece el FOB Colombia; el DOP algo mas firme (~58,7) resta un pelo de ventaja exportadora a RD. Con el flete al alza y Ormuz encareciendo rutas largas, la cercania de Colombia sigue pesando pese al peso fuerte."
    },
    {
      "title": "Puerto Rico: fondos FEMA sostienen el piso de demanda",
      "category": "demand",
      "categoryLabel": "Demanda",
      "description": "Nuevos desembolsos FEMA (US$244,5M para infraestructura, +US$91M para recuperacion) mantienen firme el consumo en PR, mercado bajo jurisdiccion de EE.UU. y el mas cercano a RD. Es el piso de demanda de Argos PR mientras la accion competitiva del trimestre ocurre a barlovento, en Jamaica y en el Golfo."
    }
  ],
  "risks": {
    "critical": [
      {
        "title": "Escalada en el Estrecho de Ormuz",
        "description": "Mas ataques a buques dispararian crudo, seguro y flete de rutas largas a la vez, encareciendo el clinker puesto y todo el costo de energia del horno. Con crudo y flete ya subiendo juntos, es el riesgo #1 de la semana."
      },
      {
        "title": "Doble apreton de costo (crudo + flete)",
        "description": "El clinker CIF Caribe sube por ambos lados simultaneamente. Si Brent se afianza sobre US$90 y el Capesize sigue arrastrando al Panamax, el costo puesto se comprime sin alivio compensatorio."
      },
      {
        "title": "Sobreoferta en RD por capacidad nueva",
        "description": "Cibao con su linea de clinker, Domicem con su segunda linea y el resto de la industria presionan precios internos y empujan a exportar en un mercado externo tambien competido."
      }
    ],
    "emerging": [
      {
        "title": "Cierre de la ventana jamaicana",
        "description": "Carib Cement reexporta desde septiembre y ya es rentable; los cupos de importacion son a 6 meses. Si el incumbente se normaliza antes de lo previsto, el espacio para importadores se estrecha rapido."
      },
      {
        "title": "Reactivacion de AD/CVD sobre cemento en EE.UU.",
        "description": "Hoy no hay orden vigente sobre RD (las de gray portland cubren Mexico y Japon), pero cualquier peticion nueva golpearia directo la tesis exportadora de Domicem hacia Florida/Golfo."
      },
      {
        "title": "Demanda de EE.UU. floja pese al arancel a Canada",
        "description": "2026 es el piso ciclico (~100 Mt, -0,2%); si la Fed no recorta (hold en 3,75%, con dissenters pidiendo subir), la construccion residencial sigue debil y limita cuanto absorbe el hueco que deja Canada."
      }
    ],
    "opportunities": [
      {
        "title": "Arancel de 50% a Canada abre EE.UU. para RD",
        "description": "Canada, top-4 proveedor, sale de precio; RD entra cerca del ~6-10% y sin AD/CVD. Florida/Golfo en escasez con terminales que cubren ~12% de la demanda: destino natural para tonelada dominicana."
      },
      {
        "title": "Cercania de Colombia gana con Ormuz",
        "description": "Si escala el Estrecho, el origen cercano (Cartagena) se vuelve aun mas competitivo frente a Turquia/Vietnam para abastecer Jamaica y el Caribe: rutas cortas, menos exposicion a seguro y bunker."
      },
      {
        "title": "Barbados y plazas import-dependientes",
        "description": "Con Arawak cerrada y Carib Cement reorientandose, varias islas quedan sin fabricacion local. Demanda de importacion cercana para quien asegure logistica y terminal primero."
      }
    ]
  },
  "priceBoard": [
    {
      "group": "Clinker & cemento",
      "indicator": "Clinker FOB Turquia",
      "value": "US$45-48/t",
      "numeric": 46.5,
      "est": false,
      "week": {
        "dir": "flat",
        "sentiment": "neutral",
        "label": "≈"
      },
      "month": {
        "dir": "flat",
        "sentiment": "neutral",
        "label": "≈"
      },
      "year": {
        "dir": "up",
        "sentiment": "adverse",
        "label": "▲"
      },
      "reference": "S&P Global/Argus (ult. eval.) · ene 2026"
    },
    {
      "group": "Clinker & cemento",